product_id,product_name,category_raw,category,brand_label,brand,price,actual_price,discount_pct,rating,rating_count,inferred_reviewer_count,review_text_richness,quality,popularity,recency,price_pct,quality_pct,popularity_pct,rating_pct,recency_pct
B002PD61Y4,D-Link DWA-131 300 Mbps Wireless Nano USB Adapter (Black),Computers&Accessories|NetworkingDevices|NetworkAdapters|WirelessUSBAdapters,Computers,D-Link,mid_brand,507.0,1208.0,58.0,4.1,8131.0,8,1128.0,68.24109792284865,60.459940652818986,57.01409495548961,0.635,0.39,0.665,0.45125,0.67875
B08CYPB15D,HP 805 Black Original Ink Cartridge,"Computers&Accessories|Printers,Inks&Accessories|Inks,Toners&Cartridges|InkjetInkCartridges",Computers,HP,mid_brand,717.0,761.0,6.0,4.0,7199.0,8,869.0,64.803412462908,56.97329376854599,35.42470326409495,0.5587500000000001,0.2475,0.6075,0.3225,0.0725
B08BCKN299,"Sounce Gold Plated 3.5 mm Headphone Splitter for Computer 2 Male to 1 Female 3.5mm Headphone Mic Audio Y Splitter Cable Smartphone Headset to PC Adapter – (Black,20cm)","Electronics|Headphones,Earbuds&Accessories|Adapters",Electronics,Sounce,budget_brand,120.0,999.0,88.0,3.9,6491.0,8,2000.0,69.7893175074184,55.19287833827893,68.38649851632049,0.95125,0.5,0.585,0.21625,0.9875
B07GXPDLYQ,PRO365 Indo Mocktails/Coffee Foamer/Cappuccino/Lemonade/Milk Frother (6 Months Warranty),Home&Kitchen|Kitchen&HomeAppliances|SmallKitchenAppliances|HandBlenders,HomeKitchen,PRO365,budget_brand,249.0,499.0,50.0,3.3,8427.0,8,1695.0,57.15281899109792,61.05341246290801,52.37945103857567,0.835,0.075,0.67,0.01,0.565
B09SJ1FTYV,Sounce Protective Case Cover Compatible Boat Xtend Overall Protective Case TPU HD Clear Ultra-Thin Cover with Unbreakable Screen Guard,Electronics|Mobiles&Accessories|MobileAccessories|Cases&Covers|BasicCases,Electronics,Sounce,budget_brand,199.0,1899.0,90.0,4.0,4740.0,8,1529.0,66.40578635014836,50.03709198813057,68.56824925816024,0.86875,0.3,0.5025,0.3225,0.9925
B08K9PX15C,Zebronics Zeb Wonderbar 10 USB Powered 2.0 Computer Speaker with RGB Lights,Computers&Accessories|Accessories&Peripherals|Audio&VideoAccessories|PCSpeakers,Computers,Zebronics,mid_brand,849.0,1499.0,43.0,4.0,7352.0,8,1838.0,69.51780415430267,58.160237388724035,48.25111275964392,0.52,0.4875,0.62,0.3225,0.44625
B08YDFX7Y1,"ZEBRONICS Zeb-Dash Plus 2.4GHz High Precision Wireless Mouse with up to 1600 DPI, Power Saving Mode, Nano Receiver and Plug & Play Usage - USB","Computers&Accessories|Accessories&Peripherals|Keyboards,Mice&InputDevices|Mice",Computers,ZEBRONICS,budget_brand,299.0,449.0,33.0,3.5,11827.0,8,1242.0,59.8219584569733,68.24925816023739,43.460682492581604,0.7825,0.115,0.76,0.03875,0.31
B09KLVMZ3B,Portronics Konnect L 1.2M POR-1401 Fast Charging 3A 8 Pin USB Cable with Charge & Sync Function (White),Computers&Accessories|Accessories&Peripherals|Cables&Accessories|Cables|USBCables,Computers,Portronics,budget_brand,159.0,399.0,60.0,4.1,4768.0,8,1544.0,68.28931750741839,50.22255192878339,58.46810089020771,0.915,0.3975,0.5075,0.45125,0.7025
B00URH5E34,Inventis 5V 1.2W Portable Flexible USB LED Light Lamp (Colors may vary),Computers&Accessories|Accessories&Peripherals|USBGadgets|Lamps,Computers,Inventis,budget_brand,39.0,39.0,0.0,3.6,13572.0,8,1006.0,61.126854599406535,71.36498516320475,34.425074183976264,0.99625,0.1525,0.8,0.07,0.045
B08SBH499M,"ZEBRONICS Zeb-Warrior II 10 watts 2.0 Multimedia Speaker with RGB Lights, USB Powered, AUX Input, Volume Control Pod for PC, Laptops, Desktop",Computers&Accessories|Accessories&Peripherals|Audio&VideoAccessories|PCSpeakers,Computers,ZEBRONICS,mid_brand,649.0,1300.0,50.0,4.1,5195.0,8,1064.0,66.23442136498515,51.85459940652819,52.37945103857567,0.5800000000000001,0.295,0.545,0.45125,0.565
B09NHVCHS9,Flix Micro Usb Cable For Smartphone (Black),Computers&Accessories|Accessories&Peripherals|Cables&Accessories|Cables|USBCables,Computers,Flix,budget_brand,59.0,199.0,70.0,4.0,9378.0,8,1228.0,67.54451038575667,63.57566765578635,63.67396142433235,0.99125,0.36,0.69625,0.3225,0.84875
B09NKZXMWJ,"Flix (Beetel) Usb To Type C Pvc Data Sync And 2A 480Mbps Data Sync, Tough Fast Charging Long Cable For Usb Type C Devices, Charging Adapter (White, 1 Meter) - Xcd-C12",Computers&Accessories|Accessories&Peripherals|Cables&Accessories|Cables|USBCables,Computers,Flix,budget_brand,139.0,249.0,44.0,4.0,9378.0,8,1243.0,67.65578635014836,63.57566765578635,48.88724035608308,0.93875,0.3675,0.69625,0.3225,0.465
B07L3NDN24,"ZEBRONICS Zeb-Fame 5watts 2.0 Multi Media Speakers with AUX, USB and Volume Control (Black)",Electronics|HomeAudio|Speakers|MultimediaSpeakerSystems,Electronics,ZEBRONICS,mid_brand,499.0,799.0,38.0,3.9,6742.0,8,961.0,63.10163204747774,56.00890207715133,45.47292284866469,0.6475,0.195,0.6,0.21625,0.375
B07PLHTTB4,Zodo 8. 5 inch LCD E-Writer Electronic Writing Pad/Tablet Drawing Board (Paperless Memo Digital Tablet),"Computers&Accessories|Accessories&Peripherals|Keyboards,Mice&InputDevices|GraphicTablets",Computers,Zodo,budget_brand,100.0,499.0,80.0,3.5,9638.0,8,444.0,56.68768545994066,64.39169139465875,67.11424332344214,0.9625,0.065,0.71,0.03875,0.9525
B0814ZY6FP,"Zebronics ZEB-VITA Wireless Bluetooth 10W Portable Bar Speaker With Supporting USB, SD Card, AUX, FM, TWS & Call Function",Electronics|HomeAudio|Speakers|BluetoothSpeakers,Electronics,Zebronics,mid_brand,899.0,1199.0,25.0,3.8,10751.0,8,1938.0,68.03931750741839,66.3946587537092,39.99443620178042,0.505,0.3775,0.7425,0.1375,0.20875
B07L9FW9GF,"Zebronics Zeb-Power Wired USB Mouse, 3-Button, 1200 DPI Optical Sensor, Plug & Play, for Windows/Mac","Computers&Accessories|Accessories&Peripherals|Keyboards,Mice&InputDevices|Mice",Computers,Zebronics,budget_brand,149.0,249.0,40.0,4.0,5057.0,8,1183.0,64.91097922848664,51.261127596439174,46.55044510385756,0.9299999999999999,0.2575,0.5325,0.3225,0.40875
B0883KDSXC,USHA Armor AR1100WB 1100 W Dry Iron with Black Weilburger Soleplate (Purple),"Home&Kitchen|Kitchen&HomeAppliances|Vacuum,Cleaning&Ironing|Irons,Steamers&Accessories|Irons|DryIrons",HomeKitchen,USHA,mid_brand,599.0,990.0,39.0,3.9,16166.0,8,848.0,66.59569732937686,75.14836795252225,46.044139465875375,0.59625,0.3075,0.8325,0.21625,0.395
B00N1U9AJS,"3M Scotch Double Sided Heavy Duty Tape(1m holds 4.5Kgs) for indoor hanging applications (Photo frames, Mirrors, Key Holders, Car Interiors, Extension Boards, Wall decoration, etc)(L: 3m, W: 24mm)",Home&Kitchen|CraftMaterials|Scrapbooking|Tape,HomeKitchen,3M,budget_brand,130.0,165.0,21.0,3.9,14778.0,8,632.0,65.75,73.44213649851632,38.54043026706231,0.945,0.2775,0.8175,0.21625,0.17625
B01F7B2JCI,Dynore Stainless Steel Set of 4 Measuring Cup and 4 Measuring Spoon,"Home&Kitchen|Kitchen&HomeAppliances|Coffee,Tea&Espresso|CoffeeMakerAccessories|MeasuringSpoons",HomeKitchen,Dynore,budget_brand,184.0,450.0,59.0,4.2,4971.0,8,1287.0,68.9080118694362,51.00148367952523,57.57232937685459,0.885,0.445,0.52375,0.58,0.68625
B09PNR6F8Q,"realme 10W Fast Charging Micro-USB Cable (Braided, Black)",Computers&Accessories|Accessories&Peripherals|Cables&Accessories|Cables|USBCables,Computers,realme,budget_brand,249.0,399.0,38.0,4.0,6558.0,8,1188.0,65.80118694362017,55.637982195845694,45.47292284866469,0.835,0.285,0.595,0.3225,0.375
B09CTRPSJR,"Storio Kids Toys LCD Writing Tablet 8.5Inch E-Note Pad Best Birthday Gift for Girls Boys, Multicolor (SC1667)","Computers&Accessories|Accessories&Peripherals|Keyboards,Mice&InputDevices|GraphicTablets",Computers,Storio,budget_brand,217.0,237.0,8.0,3.8,7354.0,8,1517.0,64.52299703264094,58.23442136498517,35.59347181008902,0.85,0.24,0.6225,0.1375,0.07875
B009LJ2BXA,"Hp Wired On Ear Headphones With Mic With 3.5 Mm Drivers, In-Built Noise Cancelling, Foldable And Adjustable For Laptop/Pc/Office/Home/ 1 Year Warranty (B4B09Pa)",Computers&Accessories|Accessories&Peripherals|Audio&VideoAccessories|PCHeadsets,Computers,Hp,mid_brand,649.0,999.0,35.0,3.5,7222.0,8,1322.0,58.145400593471805,57.195845697329375,44.200667655786354,0.5800000000000001,0.0875,0.61,0.03875,0.3325
B08TDJNM3G,"E-COSMOS 5V 1.2W Portable Flexible USB LED Light (Colors May Vary, Small) - Set of 2 Pieces",Computers&Accessories|Accessories&Peripherals|USBGadgets|Lamps,Computers,E-COSMOS,budget_brand,59.0,59.0,0.0,3.8,5958.0,8,634.0,60.07566765578635,53.7833827893175,34.425074183976264,0.99125,0.12,0.565,0.1375,0.045
B0141EZMAI,"Gizga Essentials USB WiFi Adapter for PC, 150 Mbps Wireless Network Adapter for Desktop - Nano Size WiFi Dongle Compatible with Windows, Mac OS & Linux Kernel | WPA/WPA2 Encryption Standards| Black",Computers&Accessories|NetworkingDevices|NetworkAdapters|WirelessUSBAdapters,Computers,Gizga,budget_brand,269.0,800.0,66.0,3.6,10134.0,8,1063.0,60.12908011869437,65.13353115727003,62.232937685459945,0.81875,0.1275,0.7225,0.07,0.8125
B07XJYYH7L,"Wecool Nylon Braided Multifunction Fast Charging Cable For Android Smartphone, Ios And Type C Usb Devices, 3 In 1 Charging Cable, 3A, (3 Feet) (Black)",Computers&Accessories|Accessories&Peripherals|Cables&Accessories|Cables|USBCables,Computers,Wecool,budget_brand,333.0,999.0,67.0,3.3,9792.0,8,1504.0,57.00074183976261,64.91097922848664,62.64836795252226,0.7525,0.0725,0.72,0.01,0.82375
B00F159RIK,"Bajaj DX-2 600W Dry Iron with Advance Soleplate and Anti-bacterial German Coating Technology, Black","Home&Kitchen|Kitchen&HomeAppliances|Vacuum,Cleaning&Ironing|Irons,Steamers&Accessories|Irons|DryIrons",HomeKitchen,Bajaj,mid_brand,499.0,625.0,20.0,4.2,5355.0,8,721.0,66.9272997032641,52.1513353115727,38.17692878338279,0.6475,0.3325,0.55,0.58,0.16375
B07J2BQZD6,"Kuber Industries Nylon Mesh Laundry Basket|Sturdy Material & Durable Handles|Netted Lightweight Laundry Bag, Size 36 x 36 x 58, Capicity 30 Ltr (Pink)",Home&Kitchen|HomeStorage&Organization|LaundryOrganization|LaundryBaskets,HomeKitchen,Kuber,budget_brand,199.0,399.0,50.0,3.7,7945.0,8,1025.0,60.610534124629076,59.718100890207715,52.37945103857567,0.86875,0.14,0.65,0.09625,0.565
B097JQ1J5G,"Zebronics ZEB-90HB USB Hub, 4 Ports, Pocket Sized, Plug & Play, for Laptop & Computers",Computers&Accessories|Accessories&Peripherals|USBHubs,Computers,Zebronics,budget_brand,179.0,499.0,64.0,3.4,9385.0,8,1298.0,57.55637982195846,63.94658753709199,61.05155786350148,0.895,0.08,0.705,0.01875,0.7825
B0162LYSFS,"boAt LTG 500 Apple MFI Certified for iPhone, iPad and iPod 2Mtr Data Cable(Metallic Silver)",Computers&Accessories|Accessories&Peripherals|Cables&Accessories|Cables|USBCables,Computers,boAt,mid_brand,799.0,1749.0,54.0,4.1,5626.0,8,483.0,64.89169139465875,52.6706231454006,54.6643175074184,0.53375,0.2525,0.555,0.45125,0.63125
B08M66K48D,"POPIO Tempered Glass Screen Protector Compatible for iPhone 12 / iPhone 12 Pro with Case Friendly Edge to Edge Coverage and Easy Installation kit, Pack of 1","Electronics|Mobiles&Accessories|MobileAccessories|Maintenance,Upkeep&Repairs|ScreenProtectors",Electronics,POPIO,budget_brand,299.0,599.0,50.0,4.3,4674.0,8,1840.0,73.02077151335311,49.332344213649854,52.37945103857567,0.7825,0.6975,0.485,0.7175,0.565
B09SFRNKSR,"FABWARE Lint Remover for Clothes - Sticky Lint Roller for Clothes, Furniture, Wool, Coat, Car Seats, Carpet, Fabric, Dust Cleaner, Pet Hair Remover with 1 Handle & 1 Refill Total 60 Sheets & 1 Cover","Home&Kitchen|Kitchen&HomeAppliances|Vacuum,Cleaning&Ironing|Irons,Steamers&Accessories|LintShavers",HomeKitchen,FABWARE,budget_brand,298.0,499.0,40.0,4.4,290.0,8,2000.0,69.80786350148368,11.535608308605342,46.55044510385756,0.8,0.505,0.095,0.85375,0.40875
B08TR61BVK,"Tabelito® Polyester Foam, Nylon Hybrid laptopss Bag Sleeve Case Cover Pouch for laptopss Apple/Dell/Lenovo/ Asus/ Hp/Samsung/Mi/MacBook/Ultrabook/Thinkpad/Ideapad/Surfacepro (15.6 inches /39.6cm, Blue) laptopsss",Computers&Accessories|Accessories&Peripherals|LaptopAccessories|Bags&Sleeves|LaptopSleeves&Slipcases,Computers,Tabelito,budget_brand,299.0,1499.0,80.0,4.2,2868.0,8,2000.0,72.10163204747774,40.50445103857567,67.11424332344214,0.7825,0.6425,0.3775,0.58,0.9525
B0BM4KTNL1,"FIGMENT Handheld Milk Frother Rechargeable, 3-Speed Electric Frother for Coffee with 2 Whisks and Coffee Decoration Tool, Coffee Frother Mixer, CRESCENT ENTERPRISES VRW0.50BK (A1)",Home&Kitchen|Kitchen&HomeAppliances|SmallKitchenAppliances|HandBlenders,HomeKitchen,FIGMENT,mid_brand,699.0,1599.0,56.0,4.7,1729.0,6,1590.0,75.26928783382789,31.454005934718097,24.11350148367952,0.5662499999999999,0.8125,0.275,0.9875,0.0175
B09M869Z5V,Portronics MPORT 31C 4-in-1 USB Hub (Type C to 4 USB-A Ports) with Fast Data Transfer,Computers&Accessories|Accessories&Peripherals|USBHubs,Computers,Portronics,mid_brand,570.0,999.0,43.0,4.2,3201.0,8,2000.0,72.57640949554897,42.87833827893175,48.25111275964392,0.615,0.6775,0.4175,0.58,0.44625
B00SH18114,"Ikea 903.391.72 Polypropylene Plastic Solid Bevara Sealing Clip (Multicolour) - 30 Pack, Adjustable",Home&Kitchen|Kitchen&HomeAppliances|SmallKitchenAppliances|VacuumSealers,HomeKitchen,Ikea,budget_brand,160.0,299.0,46.0,4.6,2781.0,8,985.0,72.22848664688426,39.762611275964396,49.84792284866469,0.9125,0.66,0.365,0.97625,0.4825
B097C564GC,"rts [2 Pack] Mini USB C Type C Adapter Plug, Type C Female to USB A Male Charger Charging Cable Adapter Converter compatible for iPhone, Samsung S20 ultra/S21/S10/S8/S9/MacBook Pro iPad Silver",Computers&Accessories|Accessories&Peripherals|Adapters|USBtoUSBAdapters,Computers,rts,budget_brand,294.0,4999.0,94.0,4.3,4426.0,8,2000.0,75.46142433234421,48.553412462908014,68.80192878338278,0.8025,0.82,0.47625,0.7175,1.0
B0BLC2BYPX,"Zuvexa USB Rechargeable Electric Foam Maker - Handheld Milk Wand Mixer Frother for Hot Milk, Hand Blender Coffee, Egg Beater (Black)",Home&Kitchen|Kitchen&HomeAppliances|SmallKitchenAppliances|HandBlenders,HomeKitchen,Zuvexa,mid_brand,499.0,1299.0,62.0,4.7,54.0,8,2000.0,73.3887240356083,3.1899109792284865,59.80526706231455,0.6475,0.7175,0.02,0.9875,0.74375
B00K32PEW4,"Casio MJ-120D 150 Steps Check and Correct Desktop Calculator with Tax Keys, Black",OfficeProducts|OfficeElectronics|Calculators|Financial&Business,Computers,Casio,mid_brand,535.0,535.0,0.0,4.4,4426.0,8,979.0,70.45326409495549,48.553412462908014,34.425074183976264,0.6275,0.5675,0.47625,0.85375,0.045
B099SD8PRP,"Lenovo 130 Wireless Compact Mouse, 1K DPI Optical sensor, 2.4GHz Wireless NanoUSB, 10m range, 3button(left,right,scroll) upto 3M left/right clicks, 10 month battery, Ambidextrous, Ergonomic GY51C12380","Computers&Accessories|Accessories&Peripherals|Keyboards,Mice&InputDevices|Mice",Computers,Lenovo,mid_brand,579.0,1090.0,47.0,4.4,3482.0,8,1752.0,73.35756676557862,44.21364985163205,50.36721068249258,0.61,0.715,0.425,0.85375,0.49875
B0926V9CTV,Elv Mobile Phone Mount Tabletop Holder for Phones and Tablets - Black,Electronics|Mobiles&Accessories|MobileAccessories|Stands,Electronics,Elv,budget_brand,89.0,599.0,85.0,4.3,2351.0,8,1791.0,70.21661721068249,36.5727002967359,68.04896142433235,0.9825,0.55,0.32,0.7175,0.97625
B09ZHCJDP1,"Amazon Basics Wireless Mouse | 2.4 GHz Connection, 1600 DPI | Type - C Adapter | Upto 12 Months of Battery Life | Ambidextrous Design | Suitable for PC/Mac/Laptop","Computers&Accessories|Accessories&Peripherals|Keyboards,Mice&InputDevices|Mice",Computers,Amazon,mid_brand,499.0,1000.0,50.0,5.0,23.0,8,2000.0,78.31973293768546,1.5949554896142433,52.37945103857567,0.6475,0.8875,0.0125,0.99875,0.565
B0BMXMLSMM,"Lapster 65W compatible for OnePlus Dash Warp Charge Cable , type c to c cable fast charging Data Sync Cable Compatible with One Plus 10R / 9RT/ 9 pro/ 9R/ 8T/ 9/ Nord & for All Type C Devices – Red, 1 Meter",Computers&Accessories|Accessories&Peripherals|Cables&Accessories|Cables|USBCables,Computers,Lapster,budget_brand,199.0,999.0,80.0,4.5,127.0,8,2000.0,70.55637982195846,6.528189910979229,67.11424332344214,0.86875,0.5775,0.055,0.94,0.9525
B00LHZWD0C,"Luxor 5 Subject Single Ruled Notebook - A4, 70 GSM, 300 pages","OfficeProducts|OfficePaperProducts|Paper|Stationery|Notebooks,WritingPads&Diaries|CompositionNotebooks",Computers,Luxor,budget_brand,252.0,315.0,20.0,4.5,3785.0,8,1651.0,74.92210682492582,45.919881305637986,38.17692878338279,0.8275,0.78875,0.445,0.94,0.16375
B08V9C4B1J,"Synqe Type C to Type C Short Fast Charging 60W Cable Compatible with Samsung Galaxy Z Fold3 5G, Z Flip3 5G, S22 5G, S22 Ultra, S21, S20, S20FE, A52, A73, A53 (0.25M, Black)",Computers&Accessories|Accessories&Peripherals|Cables&Accessories|Cables|USBCables,Computers,Synqe,budget_brand,349.0,999.0,65.0,4.3,838.0,8,2000.0,70.06083086053411,21.550445103857566,61.62277448071216,0.74125,0.53,0.1875,0.7175,0.79875
B09Z6WH2N1,"STRIFF 12 Pieces Highly Flexible Silicone Micro USB Protector, Mouse Cable Protector, Suit for All Cell Phones, Computers and Chargers (White)",Electronics|Mobiles&Accessories|MobileAccessories|Décor,Electronics,STRIFF,budget_brand,95.0,499.0,81.0,4.2,1949.0,8,2000.0,70.66988130563799,33.345697329376854,67.55563798219583,0.9775,0.5825,0.29,0.58,0.9625
B0BQ3K23Y1,"Oratech Coffee Frother electric, milk frother electric, coffee beater, cappuccino maker, Coffee Foamer, Mocktail Mixer, Coffee Foam Maker, coffee whisker electric, Froth Maker, coffee stirrers electric, coffee frothers, Coffee Blender, (6 Month Warranty) (Multicolour)",Home&Kitchen|Kitchen&HomeAppliances|SmallKitchenAppliances|HandBlenders,HomeKitchen,Oratech,budget_brand,279.0,499.0,44.0,4.8,28.0,8,2000.0,74.93100890207714,2.1513353115727005,48.88724035608308,0.81,0.7925,0.015,0.99375,0.465
B08WKG2MWT,"Wayona Usb C 65W Fast Charging Cable Compatible For Tablets Samsung S22 S20 S10 S20Fe S21 S21 Ultra A70 A51 A71 A50S M31 M51 M31S M53 5G (1M, Black)",Computers&Accessories|Accessories&Peripherals|Cables&Accessories|Cables|USBCables,Computers,Wayona,budget_brand,379.0,1099.0,66.0,4.3,2806.0,8,2000.0,73.75519287833828,40.02225519287833,62.232937685459945,0.72125,0.735,0.37,0.7175,0.8125
B084DTMYWK,Myvn 30W Warp/20W Dash Charging Usb Type C Charger Cable Compatible For Cellular Phones Oneplus 8T 8 8Pro 7 Pro / 7T / 7T Pro Nord And Oneplus 3 / 3T / 5 / 5T / 6 / 6T / 7,Electronics|Mobiles&Accessories|MobileAccessories|Chargers|WallChargers,Electronics,Myvn,budget_brand,329.0,999.0,67.0,4.2,3492.0,8,1829.0,70.1839762611276,44.287833827893174,62.64836795252226,0.76,0.5475,0.4275,0.58,0.82375
B06XFTHCNY,"CableCreation RCA to 3.5mm Male Audio Cable, 3.5mm to 2RCA Cable Male RCA Cable,Y Splitter Stereo Jack Cable for Home Theater,Subwoofer, Receiver, Speakers and More (3Feet/0.9Meter,Black)","Electronics|HomeTheater,TV&Video|Accessories|Cables|RCACables",Electronics,CableCreation,budget_brand,439.0,758.0,42.0,4.2,4296.0,8,2000.0,73.55563798219585,47.774480712166174,47.65393175074184,0.6825,0.7275,0.4675,0.58,0.42875
B08WKCTFF3,"ZEBRONICS Aluminium Alloy Laptop Stand, Compatible with 9-15.6 inch Laptops, 7 Angles Adjustable, Anti Slip Silicon Rubber Pads, Foldable, Velvet Pouch Inside, Zeb-NS2000 (Dark Grey)",Computers&Accessories|Accessories&Peripherals|LaptopAccessories|Lapdesks,Computers,ZEBRONICS,mid_brand,899.0,1999.0,55.0,4.4,1667.0,8,1742.0,70.55712166172107,30.712166172106826,55.35237388724036,0.505,0.58,0.265,0.85375,0.64375
B08PSQRW2T,"Zoul Type C to Type C Fast Charging Cable 65W 2M/6ft USB C Nylon Braided Cord Compatible with MacBook Oneplus 9 9R Samsung Galaxy S21 Ultra S20+ (2M, Black)",Computers&Accessories|Accessories&Peripherals|Cables&Accessories|Cables|USBCables,Computers,Zoul,budget_brand,399.0,1099.0,64.0,4.1,2685.0,8,2000.0,70.06231454005935,39.05786350148368,61.05155786350148,0.7050000000000001,0.53375,0.35125,0.45125,0.7825
B00P93X6EK,"Classmate Soft Cover 6 Subject Spiral Binding Notebook, Unruled, 300 Pages","OfficeProducts|OfficePaperProducts|Paper|Stationery|Notebooks,WritingPads&Diaries|WireboundNotebooks",Computers,Classmate,budget_brand,157.0,160.0,2.0,4.5,4428.0,8,1316.0,73.87982195845697,48.6646884272997,35.06120178041543,0.9175,0.7475,0.48,0.94,0.065
B07GMFY9QM,"SOFLIN Egg Boiler Electric Automatic Off 7 Egg Poacher for Steaming, Cooking, Boiling and Frying (400 Watts, Blue)",Home&Kitchen|Kitchen&HomeAppliances|SmallKitchenAppliances|EggBoilers,HomeKitchen,SOFLIN,budget_brand,379.0,999.0,62.0,4.3,3096.0,8,1541.0,70.14614243323442,42.13649851632047,59.80526706231455,0.72125,0.5425,0.4,0.7175,0.74375
B0BP7XLX48,"Syncwire LTG to USB Cable for Fast Charging Compatible with Phone 5/ 5C/ 5S/ 6/ 6S/ 7/8/ X/XR/XS Max/ 11/12/ 13 Series and Pad Air/Mini, Pod & Other Devices (1.1 Meter, White)",Computers&Accessories|Accessories&Peripherals|Cables&Accessories|Cables|USBCables,Computers,Syncwire,budget_brand,399.0,1999.0,80.0,5.0,5.0,5,1260.0,72.6446587537092,0.44510385756676557,34.90356083086053,0.7050000000000001,0.68,0.0075,0.99875,0.0625
B09M8888DM,Portronics MPORT 31 4 Ports USB Hub (USB A to 4 USB-A Ports 4 in 1 Connector USB HUB(Grey),Computers&Accessories|Accessories&Peripherals|USBHubs,Computers,Portronics,mid_brand,499.0,799.0,38.0,4.3,2125.0,8,2000.0,72.70919881305637,34.79228486646884,45.47292284866469,0.6475,0.6825,0.3075,0.7175,0.375
B08PSVBB2X,"Zoul USB C to USB C Fast Charging Cable 65W Type C to Type C Nylon Braided Cord Compatible with Macbook Oneplus 9 10R Samsung Galaxy S22 S21 Ultra Z Flip3 Macbook Air/Pro M1 Google Pixel 11'' iPad Pro 2020/2018 (2M, Grey)",Computers&Accessories|Accessories&Peripherals|Cables&Accessories|Cables|USBCables,Computers,Zoul,budget_brand,399.0,1099.0,64.0,4.1,2685.0,8,2000.0,70.06231454005935,39.05786350148368,61.05155786350148,0.7050000000000001,0.53375,0.35125,0.45125,0.7825
B08WLY8V9S,"Tukzer Gel Mouse Pad Wrist Rest Memory-Foam Ergonomic Mousepad| Cushion Wrist Support & Pain Relief| Suitable for Gaming, Computer, Laptop, Home & Office Non-Slip Rubber Base (Blue)","Computers&Accessories|Accessories&Peripherals|Keyboards,Mice&InputDevices|Keyboard&MiceAccessories|MousePads",Computers,Tukzer,budget_brand,425.0,899.0,53.0,4.5,4219.0,8,2000.0,78.76112759643917,47.55192878338279,54.08011869436202,0.68875,0.9025,0.465,0.94,0.615
B0B5YBGCKD,"POPIO Tempered Glass Compatible for iPhone 13 / iPhone 13 Pro/iPhone 14 (Transparent) Edge to Edge Full Screen Coverage with Installation Kit, Pack of 2","Electronics|Mobiles&Accessories|MobileAccessories|Maintenance,Upkeep&Repairs|ScreenProtectors",Electronics,POPIO,budget_brand,150.0,599.0,75.0,4.3,714.0,8,2000.0,69.8160237388724,20.326409495548962,65.17989614243322,0.9225,0.5075,0.175,0.7175,0.8925
B0BN6M3TCM,"VRPRIME Lint Roller Lint Remover for Clothes, Pet | 360 Sheets Reusable Sticky Easy-Tear Sheet Brush for Clothes, Furniture, Carpet, Dog Fur, Sweater, Dust & Dirt (4 Rolls - 90 Sheet Each Roll)","Home&Kitchen|Kitchen&HomeAppliances|Vacuum,Cleaning&Ironing|Irons,Steamers&Accessories|LintShavers",HomeKitchen,VRPRIME,mid_brand,499.0,999.0,50.0,4.6,79.0,8,2000.0,71.89836795252225,4.48813056379822,52.37945103857567,0.6475,0.63,0.03625,0.97625,0.565
B09QGZM8QB,"Wayona Usb Type C 65W 6Ft/2M Long Fast Charging Cable Compatible For Samsung S22 S20 Fe S21 Ultra A33 A53 A01 A73 A70 A51 M33 M53 M51 M31(2M, Black)",Computers&Accessories|Accessories&Peripherals|Cables&Accessories|Cables|USBCables,Computers,Wayona,budget_brand,399.0,999.0,60.0,4.3,2806.0,8,2000.0,73.75519287833828,40.02225519287833,58.46810089020771,0.7050000000000001,0.735,0.37,0.7175,0.7025
B08WJ86PV2,RPM Euro Games Gaming Mousepad Speed Type Extended Large (Size - 800 mm x 300 mm x 3 mm),"Computers&Accessories|Accessories&Peripherals|Keyboards,Mice&InputDevices|Keyboard&MiceAccessories|MousePads",Computers,RPM,budget_brand,299.0,990.0,70.0,4.5,2453.0,8,2000.0,76.71364985163206,37.31454005934718,63.67396142433235,0.7825,0.855,0.325,0.94,0.84875
B07SY4C3TD,HP GT 53 XL Cartridge Ink,"Computers&Accessories|Printers,Inks&Accessories|Inks,Toners&Cartridges|InkjetInkCartridges",Computers,HP,mid_brand,596.0,723.0,18.0,4.4,3219.0,8,1625.0,72.48219584569733,42.952522255192875,37.605712166172104,0.605,0.6725,0.42,0.85375,0.13875
B09B9SPC7F,"PC SQUARE Laptop Tabletop Stand/ Computer Tablet Stand 6 Angles Adjustable Aluminum Ergonomic Foldable Portable Desktop Holder Compatible with MacBook, HP, Dell, Lenovo & All Other Notebook (Silver)",Computers&Accessories|Accessories&Peripherals|LaptopAccessories|Lapdesks,Computers,PC,mid_brand,499.0,1299.0,62.0,4.1,2740.0,8,2000.0,70.1587537091988,39.540059347181014,59.80526706231455,0.6475,0.545,0.36,0.45125,0.74375
B0BBW521YC,"LAPSTER 12pcs Spiral Cable Protectors for Charger, Wires, Data Charger Cable Protector for Computers, Cell Phones etc.(Grey)",Electronics|Mobiles&Accessories|MobileAccessories|Décor|PhoneCharms,Electronics,LAPSTER,budget_brand,99.0,999.0,90.0,4.4,305.0,8,2000.0,69.92655786350149,12.129080118694361,68.56824925816024,0.96875,0.5175,0.1,0.85375,0.9925
B08243SKCK,"Vedini Transparent Empty Refillable Reusable Fine Mist Spray Bottle for Perfume, Travel with DIY Sticker Set ( 100ml, Pack of 4)",Home&Kitchen|HomeStorage&Organization|LaundryOrganization|IroningAccessories|SprayBottles,HomeKitchen,Vedini,budget_brand,189.0,299.0,37.0,4.2,2737.0,8,2000.0,71.88649851632047,39.42878338278932,44.87574183976261,0.8825000000000001,0.6275,0.3575,0.58,0.3575
B08WKFSN84,"Wayona Type C To Type C 65W/3.25A Nylon Braided Fast Charging Cable Compatible For Laptop, Macbook, Samsung Galaxy M33 M53 M51 S20 Ultra, A71, A53, A51, Ipad Pro 2018 (1M, Grey)",Computers&Accessories|Accessories&Peripherals|Cables&Accessories|Cables|USBCables,Computers,Wayona,budget_brand,379.0,1099.0,66.0,4.3,2806.0,8,2000.0,73.75519287833828,40.02225519287833,62.232937685459945,0.72125,0.735,0.37,0.7175,0.8125
B0B86CDHL1,"oraimo 65W Type C to C Fast Charging Cable USB C to USB C Cable High Speed Syncing, Nylon Braided 1M length with LED Indicator Compatible For Laptop, Macbook, Samsung Galaxy S22 S20 S10 S20Fe S21 S21 Ultra A70 A51 A71 A50S M31 M51 M31S M53 5G",Computers&Accessories|Accessories&Peripherals|Cables&Accessories|Cables|USBCables,Computers,oraimo,budget_brand,349.0,899.0,61.0,4.5,149.0,8,2000.0,70.70474777448071,7.270029673590504,59.260014836795264,0.74125,0.585,0.065,0.94,0.7225
