product_id,product_name,category_raw,category,brand_label,brand,price,actual_price,discount_pct,rating,rating_count,inferred_reviewer_count,review_text_richness,quality,popularity,recency,price_pct,quality_pct,popularity_pct,rating_pct,recency_pct
B0BP18W8TM,"Fire-Boltt Gladiator 1.96"" Biggest Display Smart Watch with Bluetooth Calling, Voice Assistant &123 Sports Modes, 8 Unique UI Interactions, SpO2, 24/7 Heart Rate Tracking",Electronics|WearableTechnology|SmartWatches,Electronics,Fire-Boltt,premium_brand,3999.0,9999.0,60.0,4.4,73.0,8,2000.0,68.32418397626114,4.117210682492582,58.46810089020771,0.15625,0.405,0.0325,0.85375,0.7025
B09X76VL5L,"boAt Airdopes 191G True Wireless Earbuds with ENx™ Tech Equipped Quad Mics, Beast™ Mode(Low Latency- 65ms) for Gaming, 2x6mm Dual Drivers, 30H Playtime, IPX5, IWP™, Appealing Case LEDs(Sport Blue)","Electronics|Headphones,Earbuds&Accessories|Headphones|In-Ear",Electronics,boAt,premium_brand,1599.0,3490.0,54.0,3.7,676.0,8,2000.0,59.197329376854604,19.73293768545994,54.6643175074184,0.31999999999999995,0.1,0.17,0.09625,0.63125
B07D2NMTTV,Black + Decker BD BXIR2201IN 2200-Watt Cord & Cordless Steam Iron (Green),"Home&Kitchen|Kitchen&HomeAppliances|Vacuum,Cleaning&Ironing|Irons,Steamers&Accessories|Irons|SteamIrons",HomeKitchen,Black,premium_brand,3199.0,3500.0,9.0,4.2,1899.0,8,1970.0,68.49629080118693,32.93768545994065,35.67136498516321,0.19125000000000003,0.415,0.2875,0.58,0.085
B09DDCQFMT,Electvision Remote Control Compatible with Amazon Fire tv Stick (Pairing Manual Will be Back Side Remote Control)(P),"Electronics|HomeTheater,TV&Video|Accessories|RemoteControls",Electronics,Electvision,mid_brand,1299.0,1999.0,35.0,3.6,590.0,8,900.0,50.17729970326409,18.28635014836795,44.200667655786354,0.39375000000000004,0.02,0.16,0.07,0.3325
B09R1YFL6S,"Candes BlowHot All in One Silent Blower Fan Room Heater (ABS Body, White, Brown) 2000 Watts","Home&Kitchen|Heating,Cooling&AirQuality|RoomHeaters|FanHeaters",HomeKitchen,Candes,mid_brand,1090.0,2999.0,64.0,3.5,57.0,7,979.0,45.667655786350146,3.3753709198813056,29.58827893175074,0.4475,0.01,0.0225,0.03875,0.02
B09XRBJ94N,"iBELL SM1301 3-in-1 Sandwich Maker with Detachable Plates for Toast / Waffle / Grill , 750 Watt (Black)",Home&Kitchen|Kitchen&HomeAppliances|SmallKitchenAppliances|SandwichMakers,HomeKitchen,iBELL,premium_brand,2092.0,4600.0,55.0,4.3,562.0,8,2000.0,69.2967359050445,17.729970326409493,55.35237388724036,0.26,0.46,0.1525,0.7175,0.64375
B0BNDD9TN6,WANBO X1 Pro (Upgraded) | Native 1080P Full HD | Android 9 | Projector for Home | LED Cinema | 350ANSI | 3900 lumens | WiFi Bluetooth | HDMI ARC | Dolby DTS | 4D Keystone Correction (Global Version),"Electronics|HomeTheater,TV&Video|Projectors",Electronics,WANBO,premium_brand,13990.0,28900.0,52.0,4.5,7.0,4,1721.0,66.15356083086053,0.6305637982195845,20.99221068249258,0.040000000000000036,0.2925,0.01,0.94,0.0125
B09SDDQQKP,"INALSA Vaccum Cleaner Handheld 800W High Powerful Motor- Dura Clean with HEPA Filtration & Strong Powerful 16KPA Suction| Lightweight, Compact & Durable Body|Includes Multiple Accessories,(Grey/Black)","Home&Kitchen|Kitchen&HomeAppliances|Vacuum,Cleaning&Ironing|Vacuums&FloorCare|Vacuums|HandheldVacuums",HomeKitchen,INALSA,premium_brand,1799.0,3295.0,45.0,3.8,687.0,8,2000.0,60.97700296735905,19.881305637982198,49.38056379821958,0.29874999999999996,0.1475,0.1725,0.1375,0.475
B0912WJ87V,"Reffair AX30 [MAX] Portable Air Purifier for Car, Home & Office | Smart Ionizer Function | H13 Grade True HEPA Filter [Internationally Tested] Aromabuds Fragrance Option - Black",Car&Motorbike|CarAccessories|InteriorAccessories|AirPurifiers&Ionizers,Electronics,Reffair,premium_brand,2339.0,4000.0,42.0,3.8,1118.0,8,2000.0,62.03041543026706,25.148367952522253,47.65393175074184,0.24250000000000005,0.1675,0.22,0.1375,0.42875
B099K9ZX65,Hisense 108 cm (43 inches) 4K Ultra HD Smart Certified Android LED TV 43A6GE (Black),"Electronics|HomeTheater,TV&Video|Televisions|SmartTelevisions",Electronics,Hisense,premium_brand,20990.0,44990.0,53.0,4.1,1259.0,8,2000.0,67.51780415430267,26.3353115727003,54.08011869436202,0.020000000000000018,0.3575,0.2325,0.45125,0.615
B078JBK4GX,"Havells Instanio 1-Litre 3KW Instant Water Heater (Geyser), White Blue","Home&Kitchen|Heating,Cooling&AirQuality|WaterHeaters&Geysers|InstantWaterHeaters",HomeKitchen,Havells,premium_brand,2599.0,4560.0,43.0,4.4,646.0,8,1845.0,68.82121661721068,19.510385756676556,48.25111275964392,0.21875,0.44,0.1675,0.85375,0.44625
B099FDW2ZF,"Maharaja Whiteline Nano Carbon Neo, 500 Watts Room Heater (Black, White), Standard (5200100986)","Home&Kitchen|Heating,Cooling&AirQuality|RoomHeaters|ElectricHeaters",HomeKitchen,Maharaja,mid_brand,1235.0,1499.0,18.0,4.1,203.0,8,1893.0,61.62017804154301,8.902077151335313,37.605712166172104,0.4075,0.16,0.0775,0.45125,0.13875
B0978V2CP6,"Cubetek 3 in 1 LCD Display V5.0 Bluetooth Transmitter Receiver, Bypass Audio Adapter with Aux, Optical, Dual Link Support for TV, Home Stereo, PC, Headphones, Speakers, Model: CB-BT27","Electronics|HomeTheater,TV&Video|AVReceivers&Amplifiers",Electronics,Cubetek,premium_brand,1990.0,3100.0,36.0,4.0,897.0,8,2000.0,64.84792284866468,21.735905044510385,44.564169139465875,0.27875000000000005,0.25,0.19,0.3225,0.34625
B09WF4Q7B3,"Wipro Vesta 1380W Cordless Steam Iron Quick heat up with 20gm/ min Steam Burst, Scratch resistant Ceramic soleplate ,Vertical and Horizontal Ironing, Steam burst of upto .8g/ shot","Home&Kitchen|Kitchen&HomeAppliances|Vacuum,Cleaning&Ironing|Irons,Steamers&Accessories|Irons|SteamIrons",HomeKitchen,Wipro,premium_brand,1799.0,2599.0,31.0,3.6,771.0,8,1689.0,54.32047477744807,20.77151335311573,42.69473293768546,0.29874999999999996,0.0475,0.1825,0.07,0.285
B09ZPJT8B2,TCL 80 cm (32 inches) HD Ready Certified Android Smart LED TV 32S615 (Black),"Electronics|HomeTheater,TV&Video|Televisions|SmartTelevisions",Electronics,TCL,premium_brand,11990.0,31990.0,63.0,4.2,64.0,8,1487.0,60.451038575667646,3.857566765578635,60.49332344213649,0.05249999999999999,0.135,0.0275,0.58,0.765
B09ZDVL7L8,"TTK Prestige Limited Orion Mixer Grinder 500 Watts, 3 Jars (1200ml, 1000ml, 500ml) (Red)",Home&Kitchen|Kitchen&HomeAppliances|SmallKitchenAppliances|MixerGrinders,HomeKitchen,TTK,premium_brand,2199.0,3895.0,44.0,3.9,1085.0,8,611.0,55.939169139465875,24.629080118694365,48.88724035608308,0.24875000000000003,0.0575,0.215,0.21625,0.465
B06XGWRKYT,Kodak 80 cm (32 Inches) HD Ready LED TV Kodak 32HDX900S (Black),"Electronics|HomeTheater,TV&Video|Televisions|StandardTelevisions",Electronics,Kodak,premium_brand,7999.0,15999.0,50.0,3.8,3022.0,8,1728.0,62.0860534124629,41.32047477744807,52.37945103857567,0.08750000000000002,0.17,0.39,0.1375,0.565
B08MVSGXMY,Crompton Insta Comfy 800 Watt Room Heater with 2 Heat Settings(Grey Blue),"Home&Kitchen|Heating,Cooling&AirQuality|RoomHeaters|ElectricHeaters",HomeKitchen,Crompton,mid_brand,1498.0,2300.0,35.0,3.8,95.0,8,1591.0,54.259643916913944,5.118694362017804,44.200667655786354,0.35750000000000004,0.045,0.0425,0.1375,0.3325
B09MDCZJXS,"Wings Phantom Pro Earphones Gaming Earbuds with LED Battery Indicator, 50ms Low Latency, Bluetooth 5.3, 40 Hours Playtime, MEMs Mic, IPX4 Resist, 12mm Driver, 500mah case, Headphones, (Black TWS)",Computers&Accessories|Accessories&Peripherals|PCGamingPeripherals|Headsets,Computers,Wings,mid_brand,1199.0,5499.0,78.0,3.8,2043.0,8,1554.0,59.91988130563798,34.347181008902076,66.37425816023739,0.4175,0.1175,0.3025,0.1375,0.93125
B07G147SZD,NEXOMS Instant Heating Water Tap Wall Mounted with 3 Pin Indian Plug (16Amp),"Home&Kitchen|Heating,Cooling&AirQuality|WaterHeaters&Geysers|InstantWaterHeaters",HomeKitchen,NEXOMS,premium_brand,2699.0,3799.0,29.0,4.0,727.0,8,2000.0,64.58086053412462,20.400593471810087,41.993694362017806,0.21250000000000002,0.2425,0.1775,0.3225,0.27
B09Y358DZQ,"Pigeon Zest Mixer Grinder 3 Speed Control 750 Watt Powerful Copper Motor with 3 Stainless Steel Jars for Dry Grinding, Wet Grinding and Making Chutney and 3 Polycarbonate lids - Blue",Home&Kitchen|Kitchen&HomeAppliances|SmallKitchenAppliances|MixerGrinders,HomeKitchen,Pigeon,premium_brand,2033.0,4295.0,53.0,3.4,422.0,8,2000.0,52.953264094955486,14.76261127596439,54.08011869436202,0.26249999999999996,0.0375,0.125,0.01875,0.615
B0BHZCNC4P,Remote Control Compatible for Amazon Fire Tv Stick Remote Control [ 3rd Gen ](Not Compatible for Fire TV Edition Smart TV) from basesailor,"Electronics|HomeTheater,TV&Video|Accessories|RemoteControls",Electronics,Remote,mid_brand,1499.0,3999.0,63.0,3.7,37.0,8,1254.0,50.23590504451039,2.4480712166172105,60.49332344213649,0.345,0.0225,0.0175,0.09625,0.765
B0B53QFZPY,"PTron Newly Launched Force X10 Bluetooth Calling Smartwatch with 1.7"" Full Touch Color Display, Real Heart Rate Monitor, SpO2, Watch Faces, 5 Days Runtime, Fitness Trackers & IP68 Waterproof (Pink)",Electronics|WearableTechnology|SmartWatches,Electronics,PTron,mid_brand,1299.0,5999.0,78.0,3.3,4415.0,8,1833.0,55.27596439169139,48.367952522255194,66.37425816023739,0.39375000000000004,0.055,0.4725,0.01,0.93125
B07H5PBN54,"INDIAS®™ Electro-Instant Water Geyser A.B.S. Body Shock Proof Can be Used in Bathroom, Kitchen, wash Area, Hotels, Hospital etc.","Home&Kitchen|Heating,Cooling&AirQuality|WaterHeaters&Geysers|InstantWaterHeaters",HomeKitchen,INDIAS,mid_brand,999.0,2600.0,62.0,3.4,252.0,8,1966.0,49.952522255192875,10.311572700296736,59.80526706231455,0.46625000000000005,0.0175,0.09,0.01875,0.74375
B0BNV7JM5Y,"boAt Newly Launched Wave Electra with 1.81"" HD Display, Smart Calling with Ultra-Seamless BT Calling Chip,20 Built-In Watch Faces,100 + Sports Modes,Menu Personalization,In-Built Games(Charcoal Black)",Electronics|WearableTechnology|SmartWatches,Electronics,boAt,premium_brand,2999.0,7990.0,62.0,4.1,154.0,8,2000.0,63.741839762611264,7.455489614243324,59.80526706231455,0.19874999999999998,0.21375,0.06875,0.45125,0.74375
B0B56YRBNT,"Tecno Spark 9 (Sky Mirror, 6GB RAM,128GB Storage) | 11GB Expandable RAM | Helio G37 Gaming Processor",Electronics|Mobiles&Accessories|Smartphones&BasicMobiles|Smartphones,Electronics,Tecno,premium_brand,8999.0,13499.0,33.0,3.8,3145.0,8,1329.0,60.42062314540059,42.210682492581604,43.460682492581604,0.06999999999999995,0.1325,0.4025,0.1375,0.31
B07966M8XH,"Model-P4 6 Way Swivel Tilt Wall Mount 32-55-inch Full Motion Cantilever for LED,LCD and Plasma TV's","Electronics|HomeTheater,TV&Video|Accessories|TVMounts,Stands&Turntables|TVWall&CeilingMounts",Electronics,Model-P4,premium_brand,1599.0,2999.0,47.0,4.2,2727.0,8,693.0,64.28635014836794,39.24332344213649,50.36721068249258,0.31999999999999995,0.2325,0.355,0.58,0.49875
B07F366Z51,"Singer Aroma 1.8 Liter Electric Kettle High Grade Stainless Steel with Cool and Touch Body and Cordless Base, 1500 watts, Auto Shut Off with Dry Boiling (Silver/Black)",Home&Kitchen|Kitchen&HomeAppliances|SmallKitchenAppliances|Kettles&HotWaterDispensers|ElectricKettles,HomeKitchen,Singer,mid_brand,949.0,2385.0,60.0,4.1,2311.0,8,1494.0,65.2440652818991,36.42433234421365,58.46810089020771,0.49,0.26,0.3175,0.45125,0.7025
B07J9KXQCC,"Libra Room Heater for Home, Room Heaters Home for Winter, Electric Heater with 2000 Watts Power as per IS Specification for Small to Medium Rooms - FH12 (Grey)","Home&Kitchen|Heating,Cooling&AirQuality|RoomHeaters|ElectricHeaters",HomeKitchen,Libra,mid_brand,949.0,2299.0,59.0,3.6,550.0,8,2000.0,56.994807121661715,17.47032640949555,57.57232937685459,0.49,0.07,0.1475,0.07,0.68625
B09LQH3SD9,"Lifelong LLQH922 Regalia 800 W (ISI Certified) Quartz Room Heater with 2 Power settings, Overheating Protection, 2 Rod Heater (1 Year Warranty, White)","Home&Kitchen|Heating,Cooling&AirQuality|RoomHeaters|ElectricHeaters",HomeKitchen,Lifelong,mid_brand,999.0,2000.0,50.0,3.8,1163.0,8,1237.0,56.47032640949554,25.445103857566764,52.37945103857567,0.46625000000000005,0.0625,0.225,0.1375,0.565
B01M5F614J,"Morphy Richards OFR Room Heater, 09 Fin 2000 Watts Oil Filled Room Heater , ISI Approved (OFR 9 Grey)","Home&Kitchen|Heating,Cooling&AirQuality|RoomHeaters",HomeKitchen,Morphy,premium_brand,6549.0,13999.0,53.0,4.0,2961.0,8,2000.0,68.73516320474778,41.17210682492581,54.08011869436202,0.10999999999999999,0.4275,0.3875,0.3225,0.615
B0BNVBJW2S,"boAt Newly Launched Wave Electra with 1.81"" HD Display, Smart Calling Ultra-Seamless BT Calling Chip, 20 Built-in Watch Faces, 100 + Sports Modes, Menu Personalization, in-Built Games(Cherry Blossom)",Electronics|WearableTechnology|SmartWatches,Electronics,boAt,premium_brand,2499.0,7990.0,69.0,4.1,154.0,8,2000.0,63.741839762611264,7.455489614243324,63.20660237388724,0.23124999999999996,0.21375,0.06875,0.45125,0.835
B084MZXJNK,"Belkin Apple Certified Lightning To Type C Cable, Tough Unbreakable Braided Fast Charging For Iphone, Ipad, Air Pods, 3.3 Feet (1 Meters)    White",Computers&Accessories|Accessories&Peripherals|Cables&Accessories|Cables|USBCables,Computers,Belkin,premium_brand,1599.0,1999.0,20.0,4.4,1951.0,8,789.0,66.83679525222551,33.531157270029674,38.17692878338279,0.31999999999999995,0.3275,0.29375,0.85375,0.16375
B0B2CZTCL2,"Wipro Vesta 1.8 litre Cool touch electric Kettle with Auto cut off | Double Layer outer body | Triple Protection - Dry Boil, Steam & Over Heat |Stainless Steel Inner Body | (Black, 1500 Watt)",Home&Kitchen|Kitchen&HomeAppliances|SmallKitchenAppliances|Kettles&HotWaterDispensers|Kettle&ToasterSets,HomeKitchen,Wipro,mid_brand,1299.0,1999.0,35.0,3.8,311.0,8,2000.0,59.44881305637983,12.240356083086052,44.200667655786354,0.39375000000000004,0.105,0.1025,0.1375,0.3325
B09M3F4HGB,"Borosil Volcano 13 Fin Oil Filled Radiator Room Heater, 2900 W, Black","Home&Kitchen|Heating,Cooling&AirQuality|RoomHeaters|ElectricHeaters",HomeKitchen,Borosil,premium_brand,9495.0,18990.0,50.0,4.2,79.0,8,2000.0,64.89836795252225,4.48813056379822,52.37945103857567,0.0625,0.255,0.03625,0.58,0.565
B09J2QCKKM,Havells Zella Flap Auto Immersion Rod 1500 Watts,"Home&Kitchen|Heating,Cooling&AirQuality|WaterHeaters&Geysers|ImmersionRods",HomeKitchen,Havells,mid_brand,1499.0,3500.0,57.0,4.1,303.0,8,1623.0,61.0341246290801,12.01780415430267,56.45586053412464,0.345,0.15,0.0975,0.45125,0.6675
B07DZ986Q2,"Philips EasyTouch Plus Standing Garment Steamer GC523/60 - 1600 Watt, 5 Steam Settings, Up to 32 g/min steam, with Double Pole","Home&Kitchen|Kitchen&HomeAppliances|Vacuum,Cleaning&Ironing|Irons,Steamers&Accessories|Irons|SteamIrons",HomeKitchen,Philips,premium_brand,7799.0,8995.0,13.0,4.0,3160.0,8,2000.0,68.97997032640949,42.396142433234424,36.37240356083086,0.09250000000000003,0.4475,0.4075,0.3225,0.1
B08RZ5K9YH,MI 33W SonicCharge 2.0 USB Charger for Cellular Phones - White,Electronics|Mobiles&Accessories|MobileAccessories|Chargers|WallChargers,Electronics,MI,mid_brand,999.0,1999.0,50.0,4.3,1777.0,8,782.0,64.72329376854599,31.824925816023743,52.37945103857567,0.46625000000000005,0.245,0.28,0.7175,0.565
B09GBBJV72,"HP 330 Wireless Black Keyboard and Mouse Set with Numeric Keypad, 2.4GHz Wireless Connection and 1600 DPI, USB Receiver, LED Indicators , Black(2V9E6AA)","Computers&Accessories|Accessories&Peripherals|Keyboards,Mice&InputDevices|Keyboard&MouseSets",Computers,HP,mid_brand,1409.0,2199.0,36.0,3.9,427.0,8,2000.0,61.74777448071217,14.985163204747776,44.564169139465875,0.365,0.1625,0.1275,0.21625,0.34625
B09MQ9PDHR,SaiEllin Room Heater For Home 2000 Watts Room Heater For Bedroom | ISI Approved With 1 Year Warranty | For 250 Sq. Feet Blower Heater & Room Heaters Home For Winters,"Home&Kitchen|Heating,Cooling&AirQuality|RoomHeaters|FanHeaters",HomeKitchen,SaiEllin,mid_brand,979.0,1999.0,51.0,3.9,157.0,8,1886.0,57.83827893175073,7.640949554896142,53.26224035608309,0.48,0.0825,0.0725,0.21625,0.595
B08YRMBK9R,"Candes 10 Litre Perfecto 5 Star Rated Automatic Instant Storage Electric Water Heater with Special Metal Body Anti Rust Coating With Installation Kit, 2KW Geyser (Ivory)","Home&Kitchen|Heating,Cooling&AirQuality|WaterHeaters&Geysers|StorageWaterHeaters",HomeKitchen,Candes,premium_brand,3249.0,6299.0,48.0,3.9,2569.0,8,2000.0,66.34718100890208,37.98219584569733,50.96439169139466,0.18374999999999997,0.2975,0.335,0.21625,0.52
B08QHLXWV3,Kenstar 2400 Watts 9 Fins Oil Filled Radiator with PTC Fan Heater (BLACK GOLD),"Home&Kitchen|Heating,Cooling&AirQuality|RoomHeaters|FanHeaters",HomeKitchen,Kenstar,premium_brand,6850.0,11990.0,43.0,3.9,144.0,8,1563.0,56.28041543026706,7.158753709198813,48.25111275964392,0.10250000000000004,0.06,0.0625,0.21625,0.44625
B08498H13H,"HP GK320 Wired Full Size RGB Backlight Mechanical Gaming Keyboard, 4 LED Indicators, Mechanical Switches, Double Injection Key Caps, and Windows Lock Key(4QN01AA)",Computers&Accessories|Accessories&Peripherals|PCGamingPeripherals|GamingKeyboards,Computers,HP,premium_brand,1519.0,3499.0,57.0,4.3,408.0,8,2000.0,68.64391691394658,14.465875370919882,56.45586053412464,0.33125000000000004,0.42,0.1225,0.7175,0.6675
B09NY7W8YD,"POCO C31 (Shadow Gray, 64 GB) (4 GB RAM)",Electronics|Mobiles&Accessories|Smartphones&BasicMobiles|Smartphones,Electronics,POCO,premium_brand,7998.0,11999.0,33.0,3.8,125.0,8,994.0,51.603857566765576,6.454005934718101,43.460682492581604,0.08999999999999997,0.0275,0.0525,0.1375,0.31
B07KSB1MLX,AmazonBasics Digital Optical Coax to Analog RCA Audio Converter Adapter with Fiber Cable,"Electronics|HomeTheater,TV&Video|Accessories|Cables|OpticalCables",Electronics,AmazonBasics,mid_brand,1089.0,1600.0,32.0,4.0,3565.0,8,2000.0,69.47700296735904,44.881305637982194,43.03227002967359,0.44999999999999996,0.48,0.435,0.3225,0.29625
B00KRCBA6E,Maharaja Whiteline Lava Neo 1200-Watts Halogen Heater (White and Red),"Home&Kitchen|Heating,Cooling&AirQuality|RoomHeaters",HomeKitchen,Maharaja,premium_brand,2499.0,5000.0,50.0,3.8,1889.0,8,1708.0,60.316765578635014,32.86350148367953,52.37945103857567,0.23124999999999996,0.13,0.285,0.1375,0.565
B09CGLY5CX,"Crompton Insta Comfort Heater 2000 Watts Heat Convector with Adjustable Thermostats, Hybrid Cyan, Standard (‎ACGRH- INSTACOMFORT)","Home&Kitchen|Heating,Cooling&AirQuality|RoomHeaters|ElectricHeaters",HomeKitchen,Crompton,premium_brand,1959.0,2400.0,18.0,4.0,237.0,8,717.0,54.94065281899109,9.792284866468842,37.605712166172104,0.2875,0.0525,0.0875,0.3225,0.13875
B0B466C3G4,Karbonn 80 cm (32 inches) Millenium Bezel-Less Series HD Ready Smart LED TV KJW32SKHD (Phantom Black),"Electronics|HomeTheater,TV&Video|Televisions|SmartTelevisions",Electronics,Karbonn,premium_brand,8990.0,18990.0,53.0,3.9,350.0,8,2000.0,61.40652818991098,13.27893175074184,54.08011869436202,0.07750000000000001,0.1575,0.1075,0.21625,0.615
B08L879JSN,"Acer EK220Q 21.5 Inch (54.61 cm) Full HD (1920x1080) VA Panel LCD Monitor with LED Back Light I 250 Nits I HDMI, VGA Ports I Eye Care Features Like Bluelight Shield, Flickerless & Comfy View (Black)",Computers&Accessories|Monitors,Computers,Acer,premium_brand,6299.0,13750.0,54.0,4.2,2014.0,8,1537.0,66.76780415430267,34.124629080118694,54.6643175074184,0.12749999999999995,0.315,0.3,0.58,0.63125
B078WB1VWJ,"Usha EI 3710 Heavy Weight 1000-Watt Dry Iron with Golden American Heritage Soleplate, 1.75 Kg(White)","Home&Kitchen|Kitchen&HomeAppliances|Vacuum,Cleaning&Ironing|Irons,Steamers&Accessories|Irons|DryIrons",HomeKitchen,Usha,mid_brand,1110.0,1599.0,31.0,4.3,4022.0,8,1073.0,68.7440652818991,46.73590504451038,42.69473293768546,0.4325,0.43,0.4575,0.7175,0.285
B08G8H8DPL,"Bajaj Rex 750W Mixer Grinder with Nutri Pro Feature, 4 Jars, White",Home&Kitchen|Kitchen&HomeAppliances|SmallKitchenAppliances|MixerGrinders,HomeKitchen,Bajaj,premium_brand,3249.0,6375.0,49.0,4.0,4978.0,8,1074.0,64.38056379821958,51.11275964391692,51.48367952522255,0.18374999999999997,0.235,0.5275,0.3225,0.53375
B0B3X2BY3M,Crompton Gracee 5-L Instant Water Heater (Geyser),"Home&Kitchen|Heating,Cooling&AirQuality|WaterHeaters&Geysers|InstantWaterHeaters",HomeKitchen,Crompton,premium_brand,3599.0,7299.0,51.0,4.0,10324.0,8,1504.0,69.38427299703264,65.57863501483679,53.26224035608309,0.16500000000000004,0.465,0.735,0.3225,0.595
B01I1LDZGA,"Pigeon Kessel Multipurpose Kettle (12173) 1.2 litres with Stainless Steel Body, used for boiling Water and milk, Tea, Coffee, Oats, Noodles, Soup etc. 600 Watt (Black & Silver)",Home&Kitchen|Kitchen&HomeAppliances|SmallKitchenAppliances|Kettles&HotWaterDispensers|ElectricKettles,HomeKitchen,Pigeon,mid_brand,1499.0,1775.0,16.0,3.9,14667.0,8,1216.0,67.70845697329376,73.3679525222552,37.073442136498514,0.345,0.37,0.815,0.21625,0.125
B08SCCG9D4,"JBL Commercial CSLM20B Auxiliary Omnidirectional Lavalier Microphone with Battery for Content Creation, Voiceover/Dubbing, Recording (Black,Small)",Computers&Accessories|Accessories&Peripherals|Audio&VideoAccessories|PCMicrophones,Computers,JBL,mid_brand,949.0,2000.0,53.0,3.9,14969.0,8,1243.0,67.93842729970326,73.73887240356083,54.08011869436202,0.49,0.375,0.82,0.21625,0.615
B07FL3WRX5,"Wonderchef Nutri-blend Complete Kitchen Machine | 22000 RPM Mixer Grinder, Blender, Chopper, Juicer | 400W Powerful motor | SS Blades | 4 Unbreakable Jars | 2 Years Warranty | Online Recipe Book By Chef Sanjeev Kapoor | Black",Home&Kitchen|Kitchen&HomeAppliances|SmallKitchenAppliances|JuicerMixerGrinders,HomeKitchen,Wonderchef,premium_brand,3299.0,6500.0,49.0,3.7,11217.0,8,2000.0,68.79673590504451,67.7299703264095,51.48367952522255,0.1775,0.435,0.755,0.09625,0.53375
B08D9NDZ1Y,"HP Deskjet 2331 Colour Printer, Scanner and Copier for Home/Small Office, Compact Size, Reliable, Easy Set-Up Through Smart App On Your Pc Connected Through USB, Ideal for Home.","Computers&Accessories|Printers,Inks&Accessories|Printers",Computers,HP,premium_brand,3999.0,4332.96,8.0,3.5,21762.0,8,2000.0,67.89317507418399,80.71216617210682,35.59347181008902,0.15625,0.3725,0.8725,0.03875,0.07875
B01LY9W8AF,"Cello Eliza Plastic Laundry Bag/Basket, 50 litres, Light Grey",Home&Kitchen|HomeStorage&Organization|LaundryOrganization|LaundryBaskets,HomeKitchen,Cello,mid_brand,998.06,1282.0,22.0,4.2,7274.0,8,1006.0,68.8820474777448,57.64094955489614,38.91691394658754,0.47750000000000004,0.4425,0.6175,0.58,0.1825
B09XB8GFBQ,"Redmi 10A (Charcoal Black, 4GB RAM, 64GB Storage) | 2 Ghz Octa Core Helio G25 | 5000 mAh Battery | Finger Print Sensor | Upto 5GB RAM with RAM Booster",Electronics|Mobiles&Accessories|Smartphones&BasicMobiles|Smartphones,Electronics,Redmi,premium_brand,8999.0,11999.0,25.0,4.0,12796.0,8,688.0,66.8100890207715,69.43620178041543,39.99443620178042,0.06999999999999995,0.3225,0.7725,0.3225,0.20875
B07YR26BJ3,KENT 16052 Elegant Electric Glass Kettle 1.8L 2000 W | Blue LED Illumination | Borosilicate Glass Body | Boil Drying Protection | Used as Boiler | Milk | Tea | Water & Soup | 1 Year Warranty,Home&Kitchen|Kitchen&HomeAppliances|SmallKitchenAppliances|Kettles&HotWaterDispensers|Kettle&ToasterSets,HomeKitchen,KENT,mid_brand,1199.0,2000.0,40.0,4.0,14030.0,8,1001.0,68.24554896142433,72.03264094955489,46.55044510385756,0.4175,0.395,0.805,0.3225,0.40875
B09JS94MBV,"Motorola a10 Dual Sim keypad Mobile with 1750 mAh Battery, Expandable Storage Upto 32GB, Wireless FM with Recording - Dark Blue",Electronics|Mobiles&Accessories|Smartphones&BasicMobiles|BasicMobiles,Electronics,Motorola,mid_brand,1399.0,1630.0,14.0,4.0,9378.0,8,1121.0,67.06973293768546,63.57566765578635,36.60608308605342,0.375,0.3375,0.69625,0.3225,0.10875
B09P18XVW6,"Noise Pulse Buzz 1.69"" Bluetooth Calling Smart Watch with Call Function, 150 Watch Faces, 60 Sports Modes, Spo2 & Heart Rate Monitoring, Calling Smart Watch for Men & Women - Jet Black",Electronics|WearableTechnology|SmartWatches,Electronics,Noise,premium_brand,2499.0,4999.0,50.0,3.9,7571.0,8,1780.0,67.56008902077151,58.49406528189911,52.37945103857567,0.23124999999999996,0.365,0.62625,0.21625,0.565
B00NW4UWN6,Prestige PKGSS 1.7L 1500W Electric Kettle (Stainless Steel),Home&Kitchen|Kitchen&HomeAppliances|SmallKitchenAppliances|Kettles&HotWaterDispensers|ElectricKettles,HomeKitchen,Prestige,mid_brand,1043.0,1345.0,22.0,3.8,15592.0,8,1930.0,69.61572700296735,74.55489614243324,38.91691394658754,0.45499999999999996,0.4925,0.83,0.1375,0.1825
B09ND94ZRG,"Boult Audio Airbass Propods X TWS Bluetooth Truly Wireless in Ear Earbuds with Mic, 32H Playtime, Fast Charging Type-C, Ipx5 Water Resistant, Touch Controls and Voice Assistant (Red)","Electronics|Headphones,Earbuds&Accessories|Headphones|In-Ear",Electronics,Boult,mid_brand,1099.0,5999.0,82.0,3.5,12966.0,8,2000.0,65.71216617210683,69.80712166172107,67.68545994065282,0.43999999999999995,0.275,0.78,0.03875,0.965
B07V82W5CN,"HP USB Wireless Spill Resistance Keyboard and Mouse Set with 10m Working Range 2.4G Wireless Technology / 3 Years Warranty (4SC12PA), Black","Computers&Accessories|Accessories&Peripherals|Keyboards,Mice&InputDevices|Keyboard&MouseSets",Computers,HP,mid_brand,1349.0,2198.0,39.0,4.0,7113.0,8,1465.0,67.41097922848664,56.75074183976261,46.044139465875375,0.38625,0.3525,0.605,0.3225,0.395
B00H47GVGY,"USHA Quartz Room Heater with Overheating Protection (3002, Ivory, 800 Watts)","Home&Kitchen|Heating,Cooling&AirQuality|RoomHeaters|ElectricHeaters",HomeKitchen,USHA,mid_brand,1199.0,1695.0,29.0,3.6,13300.0,8,879.0,60.603857566765576,70.77151335311572,41.993694362017806,0.4175,0.1375,0.79,0.07,0.27
B0BBN56J5H,"Redmi A1 (Black, 2GB RAM, 32GB Storage) | Segment Best AI Dual Cam | 5000mAh Battery | Leather Texture Design | Android 12",Electronics|Mobiles&Accessories|Smartphones&BasicMobiles|Smartphones,Electronics,Redmi,premium_brand,6499.0,8999.0,28.0,4.0,7807.0,8,1751.0,69.39910979228486,59.495548961424326,41.40949554896143,0.12,0.4725,0.6425,0.3225,0.2525
B08H21B6V7,Nokia 150 (2020) (Cyan),Electronics|Mobiles&Accessories|Smartphones&BasicMobiles|BasicMobiles,Electronics,Nokia,premium_brand,2599.0,2999.0,13.0,3.9,14266.0,8,1439.0,68.67655786350147,72.55192878338279,36.37240356083086,0.21875,0.4225,0.81,0.21625,0.1
